id,tipo,id_publicacion,partido,comentario,likes_comentario,usuario,nombre_usuario,fecha_comentario,platform,tematica,opinion
1309262387979314,comentario,1304272334596382,,A les hores que feu quan esteu compinxats amb PSC? Solament parar la mà?,3,pfbid032M6aQz3dXqRJpiDa2cUEaPXtndTVzn2VWtN6NcAdUq2SyNcPycmmdBuf5oYmW5G6l,Joan Calaf Vivancos,2026-05-30,facebook,politica,neutra
1309262387979314,comentario,1304272334596382,,"Et dono la raó per, jo demanaria un forn per el celiacs que sempre tenim que anar força de Rubí",1,pfbid0KitYSQu7Yv7j1WLtz4DneaG1hfVacAkK8rzVNLrJJPWPVYXpVG8RoJmVJoZPxLK7l,Cristina Masdeu,2026-05-29,facebook,tecnologia_innovacio,neutra
1309262387979314,comentario,1304272334596382,,I què proposeu? Posar més mesquites???? Només sabeu Fer això,0,pfbid0ndcQ6jpJt7xXaRqSyD52z13udTp49JkvFyCrAvsR2j19dD3gXhZfGSHMsHZoteNVl,Jordi Parra,2026-06-02,facebook,otros,neutra
1309262387979314,comentario,1304272334596382,,Uns quants croassants et fan falta menjar a tú...,1,pfbid0HoPLbVKDgtTszvXZrKQECNnr1nsTGRp6kvQBnMyouutZWb93TzeTzwXf33bwjUYnl,Angela Molina,2026-05-29,facebook,otros,neutra
1309262387979314,comentario,1304272334596382,,I les botigues de ungles postisses!,0,pfbid02QP5G2bDNuYfkC17Ac7Hzj2TZXVq9iRdtujZsxSFgKDPVndQ96s6WFCawXBKVtrCMl,Albert Espin,2026-05-30,facebook,otros,neutra
1309262387979314,comentario,1304272334596382,,🤮🤮🤮🤮,0,pfbid02yNsZjNq3VbFEU7zQi9T94ZWo3iEVpMNTBRZfshppWUFxLJrCmja2nyvMYAcXzTnil,Jonathan Marin Rueda,2026-05-30,facebook,otros,neutra
1309262387979314,comentario,1304272334596382,,"Chorrada más grande...... Comercios sin ayudas y la gente q no puede ni aparcar, más cosas hay q cambiar",0,pfbid0HbGGYEBLUihrSX8QSVRAmjBgTvgW7DPbPDSGfvy5RbuRkftuWmsY3jU971Dj1aiel,Montse Paredes,2026-05-29,facebook,politica,neutra
1309262387979314,comentario,1304272334596382,,Yo quiero una tienda de telas que sean muy baratas  a trozos o peso,0,pfbid036d1BP3J2w4xGzTt8RoDmWq5fJYpWjAwCySyKT9QEpAg4tiXoB2PUCjuq8adrTf51l,Leo Llopart,2026-05-29,facebook,joventut_educacio,neutra
1309262387979314,comentario,1304272334596382,,"Yo quiero un corte inglés en las torres y un c&a en la calle mayor, puede ser?",0,100007711004416,Berto Romero,2026-05-29,facebook,otros,neutra
1302660955306124,comentario,913829575041893,,Esquema nus roba junto al.psoe ...recordi ni plaus ni pliste solun queren robarnus ?,0,pfbid023BUf2kerPicXg21bhKrTDMahi3D7sVJjUukohENVcCFBSgnSe2h8ras9XpYr7fwWl,Juan Nieto,2026-05-20,facebook,seguridad,positiva
1302660955306124,comentario,913829575041893,,,0,100029127373137,Toni Rh,2026-05-21,facebook,sin_texto,neutra
1302660955306124,comentario,913829575041893,,,0,100029127373137,Toni Rh,2026-05-21,facebook,sin_texto,neutra
1302660955306124,comentario,913829575041893,,,0,100029127373137,Toni Rh,2026-05-21,facebook,sin_texto,neutra
1302660955306124,comentario,913829575041893,,,0,100029127373137,Toni Rh,2026-05-21,facebook,sin_texto,neutra
1302660955306124,comentario,913829575041893,,,0,100029127373137,Toni Rh,2026-05-21,facebook,sin_texto,neutra
1302660955306124,comentario,913829575041893,,,0,100029127373137,Toni Rh,2026-05-21,facebook,sin_texto,neutra
1302660955306124,comentario,913829575041893,,,0,100029127373137,Toni Rh,2026-05-21,facebook,sin_texto,neutra
1302660955306124,comentario,913829575041893,,,0,100029127373137,Toni Rh,2026-05-21,facebook,sin_texto,neutra
1309143267995931,comentario,809074538952616,,Nou contracte de parcs i jardins 🌳,0,100067008107763,En Comú Podem Rubí,2026-05-31,facebook,medio_ambiente,neutra
1309143267995931,comentario,809074538952616,,Doncs podeu començar amb el pipican de antoni sedo que ha em patit accident amb un gosset per les espigues i tambe amb els arbres de avinguda coma i ribas que están malalts i están destroçan els cotxes i les voreres rellisquen i caura algu,0,pfbid02gZxHSAJwwM2kzDfCfAU7RjjbQrDB9Qezgv7dEuoHbYYHeYDZH86ZjiJ4acppyKnnl,Noemi Roman Alcañiz,2026-06-02,facebook,medio_ambiente,neutra
1307874141456177,comentario,1664869564800304,,#clubdebarri 📍,0,100067008107763,En Comú Podem Rubí,2026-05-30,facebook,deporte,neutra
1307874141456177,comentario,1664869564800304,,A veces me d la sensación de que los que vivimos de la mutua hacia las afueras de Rubí (crta Sabadell) vivimos en otro municipio aquí poca cosa se hace ni para fiestas mayores ni para navidad....una pena parece que en esta zona no pagamos impuestos 🤦,0,pfbid02fnjuX2D9kfiE7vHBQUuQz4rbttyTM1zZSyetvqHFmvLgUQfhQdsC69jJTjYQa1Ksl,Jaime Adan Ferran,2026-05-30,facebook,cultura_fiestas,negativa
1307396668170591,comentario,4632971793599218,,#festadebarri 📍✊,0,100067008107763,En Comú Podem Rubí,2026-05-29,facebook,cultura_fiestas,neutra
1307396668170591,comentario,4632971793599218,,que asco de fiesta cada año en vez de supernos vamos a peor 🤮,0,100005837504076,Ana Perez Calderon,2026-05-30,facebook,urbanismo_limpieza,negativa
1447386900765452,comentario,pfbid0rVGp5oWkBcjMqRyy42KouSHZ2m9GUuXE5ApgaJg1wMvoxjojJkfMNfYdh3TzZRPKl,,Donde comprar las entradas,2,1105689680,Mari Sin Sin,2026-05-30,facebook,habitatge_vivenda,neutra
1447386900765452,comentario,pfbid0rVGp5oWkBcjMqRyy42KouSHZ2m9GUuXE5ApgaJg1wMvoxjojJkfMNfYdh3TzZRPKl,,Cada disabte??,0,pfbid0oidDygJGYz28RM6yE4gG9jHujB23SG1gMy7vm6tXxAuG7Y5i5VTwYb37KECLGTDKl,Mercè Llopis Aguilera,2026-06-01,facebook,otros,neutra
1447386900765452,comentario,pfbid0rVGp5oWkBcjMqRyy42KouSHZ2m9GUuXE5ApgaJg1wMvoxjojJkfMNfYdh3TzZRPKl,,i diumenge? i musica dels 80 90?,0,pfbid02dwAjTPo9JuMJn61V6iZuA3JdqQDMwdN9nNc5xxAj1fQjjSLYvEMRnBp9jkbhzHsnl,Quim Iniesta,2026-05-30,facebook,cultura_fiestas,neutra
1447386900765452,comentario,pfbid0rVGp5oWkBcjMqRyy42KouSHZ2m9GUuXE5ApgaJg1wMvoxjojJkfMNfYdh3TzZRPKl,,"Podrían dar un poco de publicidad a estos eventos, porque de haberme enterado habría ido y seguro que como yo más gente 🥲",2,pfbid0Xnbg4uV9ckbqYYxoLtXtLdKPCDxHvJx315VdZbopViyeZJ7DhGheEj6GKY7NpKBrl,Cristina Ch,2026-05-30,facebook,economia_empresa,neutra
1447386900765452,comentario,pfbid0rVGp5oWkBcjMqRyy42KouSHZ2m9GUuXE5ApgaJg1wMvoxjojJkfMNfYdh3TzZRPKl,,En taquilla no se pueden sacar entradas?,0,pfbid02XLVmYUqx9PNKRr37MrYqE8CTMG3qhhj5DkdSehSyhu5WbsjoV6YD1mL8iF2Mjsbql,Aurora Campuzano,2026-05-30,facebook,politica,neutra
1447386900765452,comentario,pfbid0rVGp5oWkBcjMqRyy42KouSHZ2m9GUuXE5ApgaJg1wMvoxjojJkfMNfYdh3TzZRPKl,,Donde se cogen las entradas?,0,pfbid02fZJpsL1yQRvVefCZJEb8MeCgVEX53AaFSdjvH2EpJjjdBTsNNV5ADDTPgukf4E8xl,Encarna Lopez Garrido,2026-05-30,facebook,otros,neutra
1447386900765452,comentario,pfbid0rVGp5oWkBcjMqRyy42KouSHZ2m9GUuXE5ApgaJg1wMvoxjojJkfMNfYdh3TzZRPKl,,👏👏👏,0,1829807950,Manel López,2026-05-29,facebook,otros,positiva
1447386900765452,comentario,pfbid0rVGp5oWkBcjMqRyy42KouSHZ2m9GUuXE5ApgaJg1wMvoxjojJkfMNfYdh3TzZRPKl,,👏👏👏👏👏,0,pfbid0enrsY4jrzLadxx3iXyYdX69oeVpgy7CMwSD2wbVTp1csxdzUgq2zoDbPGR3WW7FKl,Encarna Plaza,2026-05-29,facebook,otros,positiva
1603325285128122,comentario,1817067166308486,,"I tant que tenim un teixit empresarial solvent, en Rubí les indústries poden fer el que volent sense cap mirament, està tot permès, aquest consistori no posarà cap trava a cap indústria com tal que s'instal·li a la nostra ciutat, no cal respectar el medi ambient no res, està tot permès.",1,pfbid02LRqoXC2SG4WU8v74p2YeJXpw68ProPAqY7zQuGWDdb25m8YaZrZaTsGdwKMXzUgml,Jordi Vericat,2026-06-01,facebook,medio_ambiente,neutra
1603325285128122,comentario,1817067166308486,,Calla fumao,0,pfbid0H3GMNr3NTyoQtdNemeaLQxzojJnPxpe8kuct8oGBYVKp9FbQageqN6UVNoUV729wl,Adri Fernandez,2026-06-02,facebook,otros,neutra
1440289931463932,comentario,1001633348904273,,"totalment d'acord! com a membres de la familia i empadronats a Rubí, s'han de tenir en compte també a nivell urbà les necessitats dels gossos creant més espais per als petits i per als grans que cada cop n'hi han més gossos  i els pipicans que n'hi han a part de ser insuficients deixen mooolt que dessitjar!",1,pfbid02n2fRZu3NDCBXc5xE4uyquwmuPFhEKCQbMgqmxCoMJM5Y73na5pQCBwi2DowoxRfrl,Lía Cats,2026-05-28,facebook,animals_fauna,neutra
1440289931463932,comentario,1001633348904273,,"Correcte! A dins de tots i cadascun d'aquests espais cal que hi hagi una font d'aigua potable. Respecte a la vegetació, afegiria que el seu manteniment, tot i que ha millorat, és insuficient: cal retirar la vegetació invasiva, actualment està tot ple d'espigues. Quan les tallen, diuen que les retiren, però no és pas cert: deixen les espigues seques a les àrees d'esbarjo pera gossos, amb el perill que comporta.",0,pfbid0crozn8P6UvCuz3K7aZGJfpttRVbWY63TSN6yyxMm9LncujQgKEKG9wUm2WSAPw4kl,César GL,2026-05-28,facebook,animals_fauna,negativa
1440289931463932,comentario,1001633348904273,,Pero es mejor hacer un paseo en la avenida del estatut,0,537088096,Maika Sorroche,2026-05-28,facebook,otros,neutra
1440289931463932,comentario,1001633348904273,,Totalmente de acuerdo 👏,0,100001960156498,Carmen Sanchez Flores,2026-05-28,facebook,gestio_municipal,positiva
1440289931463932,comentario,1001633348904273,,Nosotros llevamos 5 años denunciando el pipican del 25 d septiembre donde los perros se han hecho daño con bastantes puntos x rajarse las patas con el vallado y ni casi incluso denunciados al sindicat de greuges,0,pfbid0Tm7D4qW6bmK1V4ynR549QLUuGptLW2LjcqwdynEEpwyuA9mnjcNGJVJGYnFixkLMl,Fanny CA,2026-05-28,facebook,seguridad,neutra
1440289931463932,comentario,1001633348904273,,Podrian poner una patrulla que vaya multando a todos los que dejan que se perro se mee y se cage en las aceras y zonas verdes de el pueblo a pesar de que hay un monton de pipicanes y de ese dinero de multar a los dueños se podria reparar esas zonas y sobra dinero seguro,0,1332395558,Raul Martin Garcia,2026-06-01,facebook,seguridad,neutra
1440289931463932,comentario,1001633348904273,,Totalmente de acuerdo está asqueroso lleno de cosas y las bichos para los perros cogen garrapatas y de todo tendrías que fumigar también,0,pfbid08Uo99X1v6Z6hCkMCiuuvGpcjNZGixhca7Ui3uXji4aLsicYNGwKAQpoYKNbTwMC5l,Esther Macias Garcia,2026-05-28,facebook,animals_fauna,neutra
1437616455064613,comentario,919202271168398,,I zones en estat lamentable a tocar dels habitatges..,2,pfbid0rqofV93UZEoLyWaijpAY55cbcrUa8YQ4xQ8SeS1KJQMhphJEfijbRYWseVm1XyATl,Elena Garcia,2026-05-25,facebook,okupacion,neutra
1437616455064613,comentario,919202271168398,,"totalment d'acord! ademès els arbres son un bon refugi climàtic i a Rubí, els dies de calor, no es pot passejar per enlloc perquè els pocs arbres que n'hi han son ""branquetes""",0,pfbid02n2fRZu3NDCBXc5xE4uyquwmuPFhEKCQbMgqmxCoMJM5Y73na5pQCBwi2DowoxRfrl,Lía Cats,2026-05-25,facebook,medio_ambiente,neutra
1437616455064613,comentario,919202271168398,,"Zones verdes i mes arbres, i tant ,Xò, Vosaltres també sou feligresos de l’església del Sant canvi climàtic?",0,pfbid02avm4Yy8AYa2Pv25g8jcAtG2KmY8VDYt85jwEniEc55BjR2vZVkD7AsoPsp5rxBgol,Alfunset Alfonsito Marín,2026-05-25,facebook,medio_ambiente,neutra
1437616455064613,comentario,919202271168398,,Y sucia sobre todo en las urbanizaciones parte por el incivismo de algunas personas y parte por la falta de mantenimiento....porque árboles tenemos pero mantenimiento 0....eso sí radar para poner multas en una carretera sin señalizar y donde no se puede ir a menos de 50....eso sí están listos,3,pfbid0C9eUEWzfVKqwwf8KnvTef2xRMr53xuQuYVpj3AjvSzUi7s2FESH6LHZc5MprUmyql,Ana Maria,2026-05-25,facebook,seguridad,neutra
1437616455064613,comentario,919202271168398,,"Esos árboles en veranos anteriores he tenido que bajar con cubos de agua cuando voy a casa de mis suegros y regalos, algunos ya están muertos, otros por los pelos.",1,pfbid0mSvDkVjAmvcN7s7y116taywaJqgFWCknUvsiDC28JeMeKe9S8MbA1RHmGKaryoSFl,Manel Cervantes,2026-05-25,facebook,medio_ambiente,neutra
1524275349739051,comentario,pfbid028vEvSHL98wKW3tPQ4hmCA57ahZeQvr4dcKYW1E2e7sYroR5dbEdLcaZMXnakuFs5l,,"Lis mejores,!!!❤️❤️❤️❤️",0,pfbid027tW83RVRKMequbHs3YzrjN8YK9GzziifyXwLd71tavWrEcmWvDB1UWwftSo1dQgxl,Montse Jimenez Martinez,2026-06-01,facebook,otros,positiva
1524275349739051,comentario,pfbid028vEvSHL98wKW3tPQ4hmCA57ahZeQvr4dcKYW1E2e7sYroR5dbEdLcaZMXnakuFs5l,,😘♥️,0,pfbid028pfuMBUjdKVBdvxrDh438iriBnzkYVuAj3oFrtC21pPffDjvWchY1u2VZ2kG9mS5l,Maria Dolores Fernández Montiel,2026-06-01,facebook,otros,neutra
1524275349739051,comentario,pfbid028vEvSHL98wKW3tPQ4hmCA57ahZeQvr4dcKYW1E2e7sYroR5dbEdLcaZMXnakuFs5l,,Traductor: El equipo estatal debuta con una coreografía basada en un pedazo de Rosalia y solo un error final privado del oro ante Canadá,0,pfbid0Z1NFZUCD3DVWJv3EiAwkDRJUUEJha3djpidpaZJGBvjYo37z3sHV1xZ7qDct92eBl,Victor M. Cafo,2026-06-01,facebook,deporte,neutra
1345708444324311,comentario,pfbid0TQgh3hj99xnr2HHXyGxf5xFR3XjNeHdEAYLmXWY43hhGVn4EFN3BytnkrjNbfc3Zl,,"Los primeros incívicos sois los fascistas. Tú te estás promociónando por los medios, pero tú y tú partido ya sabemos lo que sois,. 
Unos fascistas",0,pfbid02PuE3QukrAxtJihvkyZ1uUTwkhsYt7WaXfRW8R6kcv9VpU8oNhbDG6sD9md5dsGwal,Jose Antonio Garcia Salvador,2026-05-28,facebook,gestio_municipal,neutra
1344866891075133,comentario,2751837945191272,,AQUEST NOI SOMIA TRUITES,1,pfbid02g3NiFQz3zj8mi7QT33QknQQ3MVoYzzCDE9tLhK96bzmyTsJox1T6Kox2WPov9fR2l,Alfred Serra Riera,2026-05-27,facebook,tecnologia_innovacio,neutra
1344866891075133,comentario,2751837945191272,,Qué ridículos!,1,100015612392020,Deiivid Guitars,2026-05-27,facebook,otros,neutra
1344866891075133,comentario,2751837945191272,,Segueis somian que es gratis!!,1,pfbid02pE7RJQpMcwsDb1heP6pEDa7htRwET5mWdRBn9BY2ffhrZuj1XZNLRzAHasoYYdJil,Didac Diaz,2026-05-26,facebook,tecnologia_innovacio,neutra
1344866891075133,comentario,2751837945191272,,🤮🤮🤮🤮💩💩💩💩💩👻👻👻👻,1,pfbid0XuG5rWAW64GW8RX1jbAU8GC4AGW5z917zENTKpvwAYTwsKLTP7y4PYPGccSHvib4l,Ana Zahiño Espejo,2026-05-27,facebook,otros,neutra
1292650596307160,comentario,4564619890435608,,Una pregunta para los de ERC RUBI... Hicisteis consulta con los habitantes de Rubí o afiliados sobre el tema de la ZBE? porque votar que SI a la ZBE sin consultar a sido un acto de dictadura impuesta por vosotros.,1,pfbid0EJakj8mjhtTvu7u9qXQ2AKTz6tGmGDM6Hvroa6ZiqFtqAVpL5jqTS9XTk54xriZSl,Ismael Lopez Rico,2026-05-10,facebook,politica,neutra
1292650596307160,comentario,4564619890435608,,A ver si cambiáis desde discurso siempre lo mismo y no hacéis nada ya sabemos que los rubinenses necesitamos un hospital hace mucho tiempo y una sanidad pública y de calidad pero es que ninguno habéis hecho nada y no vais a hacer nada sois todos unos cantamañanas y vosotros de Esquerra Republicana no tenéis nada,0,pfbid0XuG5rWAW64GW8RX1jbAU8GC4AGW5z917zENTKpvwAYTwsKLTP7y4PYPGccSHvib4l,Ana Zahiño Espejo,2026-05-09,facebook,salut_sanitat,neutra
1292650596307160,comentario,4564619890435608,,"Menudos FALSOS. Os recuerdo quien gobernaba la Generalitat hace 4 días, como aquel que dice....

Sois unos vendidos a los socialistas.",0,pfbid0DqwDKgcjBd7SQAVLwGSnV5c5cWQHHCDzRwgEdCrfgCo1xPjEfJXbhahLZUyBJu4Kl,Aitor Tilla,2026-05-10,facebook,tecnologia_innovacio,positiva
1292650596307160,comentario,4564619890435608,,"SOBRE EL HOSPITAL DE RUBÍ. Y SOBRE LOS QUE DENUNCIAN SIN ACTUAR.
ERC acaba de publicar que gracias a sus preguntas en el Parlament han descubierto que el plan funcional del futuro centro de salud de Rubí no estará terminado hasta julio. Es decir, ni siquiera han terminado el papel. El hospital sigue siendo una promesa. Una más.
Le doy las gracias a ERC por la información. Es útil. Es necesaria. Y es exactamente el tipo de control político que debe hacerse.
Pero hay algo que también necesito decir.
ERC lleva años en la oposición de Rubí denunciando exactamente esto. El hospital prometido que no llega. El POUM bloqueado. La vivienda en crisis. El Casino de 8 millones. Los contratos millonarios a las mismas empresas. Lo denuncian en el Pleno. Lo denuncian en el Parlament. Lo publican en redes.
Y luego llegan los presupuestos. Y se abstienen. Y los presupuestos que critican se aprueban con su abstención.
Denunciar y luego abstenerse no es oposición. Es teatro.
Los vecinos de Rubí no necesitan más partidos que denuncien por la mañana y se abstengan por la tarde. Necesitan un gobierno que resuelva los problemas de una vez.
El hospital de Rubí lleva décadas prometido. La espera media para salud mental infantojuvenil es de 87 días. Rubí tiene menos personal sanitario por habitante que cualquier otra ciudad comparable de Catalunya. Y el plan funcional del nuevo centro de salud no estará terminado hasta julio.
Mientras tanto el Ayuntamiento del PSC inauguró el Casino con casi 8 millones de euros.
Yo no soy del PSC. No soy de ERC. No soy de ningún partido. No le debo nada a nadie.
Y cuando llegue al gobierno de Rubí, el hospital no será un plan funcional pendiente de redactar. Será una exigencia diaria, documentada y pública ante la Generalitat hasta que sea una realidad.
Las palabras son gratis. Los actos no.
Únete al canal y sigue la investigación:
https://t.me/viviendadignaenRubi
Comparte. Que lo sepa toda Rubí.
#RubíMerecesMás #HospitalRubí #ViviendaDignaRubí #DenunciaPública #DenunciarYAbstenerse​​​​​​​​​​​​​​​​",0,100030068400649,Alejandro Romero,2026-05-09,facebook,politica,positiva
1292650596307160,comentario,4564619890435608,,"VERGÜENZA:
Según la oficial que ha puesto la denuncia, me dice que es protocolo del ayuntamiento. Tiene órdenes del Ayuntamiento de multar las matrículas extranjeras directamente
Ayuntamiento de Rubí multando con ticket en regla 🚨
Hoy me han puesto una multa de 100€ en el Aparcament L’Escardívol (Zona Taronja RUB-021) a las 11:24h… con el ticket de la app pagado desde las 11:13h y válido hasta las 12:43h.
Es decir: el agente me multa sabiendo que hay ticket activo. 1h 16min pagados, todo en regla, y aun así: MULTA.
Curioso además que esto solo me pasa con mi coche de matrícula alemana. Con matrícula española, nunca. ¿Casualidad? ¿Protocolo? El patrón es demasiado repetido para ignorarlo.
El ORGT ni siquiera ha recibido todavía el expediente porque el Ayuntamiento no lo ha tramitado. Mientras tanto, el ciudadano tiene que perder su tiempo reclamando lo que nunca debió ocurrir.
¡Vergüenza, Ajuntament de Rubí! 🏛️❌
#Rubí #Multa #AjuntamentDeRubí #Abuso #",0,100030068400649,Alejandro Romero,2026-05-15,facebook,seguridad,negativa
1445648564272619,comentario,pfbid02PZZuwfYWuVw3KZVrqPwDabAJ19BBxJ6kraxcyV6HXmy3TFtnRAecqrKroEeHAxRMl,,Quan tornarà? O es repetirà la història de la restauració de la xemeneia de l'Escardivol que va durar anys i panys.🤷,3,pfbid03juyCAi5YzYj5BT843DhdgWEziAfYuygMASBotL9sHeF4iQef7e93V7BTAJmr5Bdl,Lluïsa Pernas Muray,2026-05-27,facebook,tecnologia_innovacio,neutra
1445648564272619,comentario,pfbid02PZZuwfYWuVw3KZVrqPwDabAJ19BBxJ6kraxcyV6HXmy3TFtnRAecqrKroEeHAxRMl,,"A quina decada tornara? 
Perque parlar d’anys es poc",5,100000010672105,Lluis Dalmau Ferrer,2026-05-27,facebook,otros,neutra
1445648564272619,comentario,pfbid02PZZuwfYWuVw3KZVrqPwDabAJ19BBxJ6kraxcyV6HXmy3TFtnRAecqrKroEeHAxRMl,,Menús mal perquè si arriba a caurà es per matar-los que no veuen que descalsandala  pasaria això no es necesita se arquitecta,1,pfbid0MgaRwPaVz8W7XPpKsHsoAKHcwd7VQBPiXhi9zgC2fbE5q16qFD5BTyTFGftaHYU8l,Mercé Odena Sangrá,2026-05-27,facebook,tecnologia_innovacio,neutra
1445648564272619,comentario,pfbid02PZZuwfYWuVw3KZVrqPwDabAJ19BBxJ6kraxcyV6HXmy3TFtnRAecqrKroEeHAxRMl,,"A veure , si no torna? Passa alguna cosa?",1,100088945386772,Dani Prada,2026-05-28,facebook,otros,neutra
1445648564272619,comentario,pfbid02PZZuwfYWuVw3KZVrqPwDabAJ19BBxJ6kraxcyV6HXmy3TFtnRAecqrKroEeHAxRMl,,"A Rubi, desapareixen fons, sortidors, arbres, figures….Rubi, robar, carregar i marxar. Es la seva politica.",0,pfbid02Zzox1ceQ69yHZbBj4AMRXrLU3agJ47aahU3p3qHrtAccS2WGFgCes9QDvHnwjnefl,Roser Miralles Colomer,2026-05-28,facebook,politica,neutra
1445648564272619,comentario,pfbid02PZZuwfYWuVw3KZVrqPwDabAJ19BBxJ6kraxcyV6HXmy3TFtnRAecqrKroEeHAxRMl,,Ara no es millorar eh?,1,1342362349,Silv Romero Obispo Gurujiwan,2026-05-27,facebook,otros,neutra
1445648564272619,comentario,pfbid02PZZuwfYWuVw3KZVrqPwDabAJ19BBxJ6kraxcyV6HXmy3TFtnRAecqrKroEeHAxRMl,,"Como con la fuente de la Plaza Doctor Pearson,ya no está",7,pfbid0t1jXbCVJ116r1qW4r2JDRiwHkeCjKjzPiwSAzX1hMhL7p5tpiRKXXDAyrAWHxjUgl,Pedro Hidalgo Proia,2026-05-27,facebook,otros,neutra
1445648564272619,comentario,pfbid02PZZuwfYWuVw3KZVrqPwDabAJ19BBxJ6kraxcyV6HXmy3TFtnRAecqrKroEeHAxRMl,,Lo q tiene q restaurar se es la alcaldía y sacar a toda la panda de chupocteros incluida la anamari y se quede en sant cugat!!,1,pfbid0bBqDQvY8FfAsXwmyNeXbUym9KLpYVzbno2FywPjRUvGyK4KSeQovLLPc8tkb4qaEl,Juan Carlos Calderón,2026-05-28,facebook,animals_fauna,neutra
1445648564272619,comentario,pfbid02PZZuwfYWuVw3KZVrqPwDabAJ19BBxJ6kraxcyV6HXmy3TFtnRAecqrKroEeHAxRMl,,Que patetismo de comentarios cuanto amargado,0,61572386260535,Sheila Gonzalez ,2026-05-30,facebook,otros,neutra
1445648564272619,comentario,pfbid02PZZuwfYWuVw3KZVrqPwDabAJ19BBxJ6kraxcyV6HXmy3TFtnRAecqrKroEeHAxRMl,,Que pena ..,0,61557343199616,Luisito Oliet,2026-05-29,facebook,otros,neutra
1445389454298530,comentario,1345204677521049,,,0,pfbid0p7EQDdXcj1nJTLQppDEPJugqt8rRHCgmvbhcbQzy5sT3TUyZEzHRT1e8e924xnRVl,Joana Fernández González,2026-05-27,facebook,sin_texto,neutra
1445389454298530,comentario,1345204677521049,,L'edat  no importa  💛,0,pfbid0p7EQDdXcj1nJTLQppDEPJugqt8rRHCgmvbhcbQzy5sT3TUyZEzHRT1e8e924xnRVl,Joana Fernández González,2026-05-27,facebook,otros,positiva
1444771354360340,comentario,pfbid02cMsMRxqZCEVNgJ3ZFNo15LFSmFBDNKLqCpJiz1BD2wJn63UQrZP7r7sxC6RkHzWHl,,"Muchísimas felicidades!!! Qué recuerdos del Colmado Oller, ahí comprábamos a granel las galletas de chocolate, las legumbres, el café.... Recuerdo aún el olor al entrar 🥰",2,pfbid02H6ydVHASkubAtdBQNkdQ7aEGsz7yfsdypsaEcEyWbxeo7EUM4YuZBjezYknDkS5Vl,Cristina Redondo,2026-05-26,facebook,reaccio_emocional,positiva
1444771354360340,comentario,pfbid02cMsMRxqZCEVNgJ3ZFNo15LFSmFBDNKLqCpJiz1BD2wJn63UQrZP7r7sxC6RkHzWHl,,"Una excel·lent persona, tant amb la seva vida professional i personal.
A la meva joventut varen coincidir a l'esbart i era una persona molt estimada.
Núria gaudeix d'aquests 100 anys. Una abraçada i molts petons 🥰🥰",0,pfbid0xiydw3CJwjGRJFwpiuMNAUck2JeACHgd8qUNEXRF8JniTqTRL7MCbmRd8vDEpB9Pl,Imma Ferrer,2026-05-26,facebook,tecnologia_innovacio,positiva
1444771354360340,comentario,pfbid02cMsMRxqZCEVNgJ3ZFNo15LFSmFBDNKLqCpJiz1BD2wJn63UQrZP7r7sxC6RkHzWHl,,"Moltes felicitats Nuria, fer 100 anys es una sort i voldria desitjar-vos el millor, una abraçada",0,pfbid0277qTumShTNGpTMAtqMMhySSEbnHk6gd1GAGrj6647K6PgjJANzS3KXvgHQfXekikl,Lluis Bogunya,2026-05-28,facebook,tecnologia_innovacio,positiva
1444771354360340,comentario,pfbid02cMsMRxqZCEVNgJ3ZFNo15LFSmFBDNKLqCpJiz1BD2wJn63UQrZP7r7sxC6RkHzWHl,,Per molts anys !!! Una abraçada,0,pfbid0wnNZxwU6bZsdpFnwQZpaQU8jDhp6kpPpDNzcMbiWfA1mrAYg3GvagLAptsq1tBXGl,Conxita Nonell,2026-05-26,facebook,otros,neutra
1444771354360340,comentario,pfbid02cMsMRxqZCEVNgJ3ZFNo15LFSmFBDNKLqCpJiz1BD2wJn63UQrZP7r7sxC6RkHzWHl,,Felicidades guapa,0,pfbid031Bw3zLtEat45QUc23cKTwTgc1B9UZRrbFg5z9RPPNSGMK3qpX1wyLCFNesfYS96Zl,Encarna Crespo Gual,2026-06-01,facebook,reaccio_emocional,positiva
1444771354360340,comentario,pfbid02cMsMRxqZCEVNgJ3ZFNo15LFSmFBDNKLqCpJiz1BD2wJn63UQrZP7r7sxC6RkHzWHl,,Moltes Felicitats,0,100011166217907,Montse E Miret,2026-05-26,facebook,reaccio_emocional,positiva
1444771354360340,comentario,pfbid02cMsMRxqZCEVNgJ3ZFNo15LFSmFBDNKLqCpJiz1BD2wJn63UQrZP7r7sxC6RkHzWHl,,Felicidades,0,pfbid0ewAGdU6jYauFisWz4nWiButHQFzCufqwBNe4wUXPiorT6xp21ZTsHe21zNcexdCDl,Maria Helena Henao Nieto,2026-05-27,facebook,reaccio_emocional,positiva
1444771354360340,comentario,pfbid02cMsMRxqZCEVNgJ3ZFNo15LFSmFBDNKLqCpJiz1BD2wJn63UQrZP7r7sxC6RkHzWHl,,"Per molts anys Núria, un petó ben fort!",1,pfbid0UoAzB4y3NCvzmMNUCrYkumbCGtGMeKPL99YAMzJUd2CReAmDWbgkcx7QzJHiFDL1l,Montse Julià,2026-05-26,facebook,tecnologia_innovacio,neutra
1444771354360340,comentario,pfbid02cMsMRxqZCEVNgJ3ZFNo15LFSmFBDNKLqCpJiz1BD2wJn63UQrZP7r7sxC6RkHzWHl,,Núria moltes felicitats pels teus 100 anys. Una forta abraçada.,0,pfbid0QrpEAXTPz31LbhQny9UQ3Sj9NBUDDWWxWZz3SdXb4ZyBNEXCgGXD8ewcqXmF8bBCl,Joan Enrich,2026-05-29,facebook,tecnologia_innovacio,positiva
1444771354360340,comentario,pfbid02cMsMRxqZCEVNgJ3ZFNo15LFSmFBDNKLqCpJiz1BD2wJn63UQrZP7r7sxC6RkHzWHl,,Per molts anys Núria. No crec que amb recordis .,0,1518439341,Teresa Arus Buenhombre,2026-05-27,facebook,tecnologia_innovacio,positiva
1307180808192177,comentario,2249422565597074,,#patrimoni,0,100067008107763,En Comú Podem Rubí,2026-05-29,facebook,turisme_natura,neutra
1306575241586067,comentario,4492748200954308,,Seguridad,2,100067008107763,En Comú Podem Rubí,2026-05-28,facebook,seguridad,neutra
1306575241586067,comentario,4492748200954308,,"Creiem que el paper principal NOSTRE ES: prevenir, cuidar, detectar conflictes, intervenir abans que sigui massa tard i construir convivència. No podem convertir la policia municipal en una extensió de l’acusació penal.",2,1152502331,Jordi Arnaiz,2026-05-28,facebook,seguridad,negativa
1306575241586067,comentario,4492748200954308,,"No podem construir la seguretat sobre el discurs de mà dura, i que alimenta la dreta i l’extrema dreta.",2,1152502331,Jordi Arnaiz,2026-05-28,facebook,politica,neutra
