id,tipo,id_publicacion,partido,comentario,likes_comentario,usuario,nombre_usuario,fecha_comentario,platform,tematica,opinion
1335336292028193,comentario,2453604478415375,,Lo mide por donde se mide nadie tiene derecho a ocupar una vivienda que no es suya vale porque cada uno tenemos la vivienda porque no la hemos currado toda la p*** vida trabajando y ahora vienen cuatro listos y cuatro lacras de la sociedad y ellos tienen más derechos que los dueños de la vivienda venga hombre venga venga porque no tienen huevos de meterse en la casa de la alcaldesa o de un policía o de un notario un juez se meten en las viviendas de gente trabajadora venga el que no lo haya vivido en sus propias carnes no sabe lo que es eso nosotros lo vivimos un piso ocupado durante ocho años y después lo dejaban o lo dejaron hecho una m***** para hacerlo de nuevo otra vez el que ocupa una vivienda por lo menos que la respete que la cuide,0,pfbid0XuG5rWAW64GW8RX1jbAU8GC4AGW5z917zENTKpvwAYTwsKLTP7y4PYPGccSHvib4l,Ana Zahiño Espejo,2026-05-15,facebook,politica,negativa
1335336292028193,comentario,2453604478415375,,Primero limpieza porque Rubí  es un pueblo bonito pero desde que salgo de la puerta ha la calle ahy  cacas de peros de da asco   parese  un pipikam,0,pfbid0ZCHeQW2a37w4S7CFP8BJvFMSjoTv9VcL9r2MdXFAj8kZ1r9n5eV7L94R1unmAfHpl,Ana Murillo,2026-05-16,facebook,urbanismo_limpieza,negativa
1335336292028193,comentario,2453604478415375,,"Que basura de país, nos están dejando las leyes buenistas de los políticos de este país. Esto es una anarquía total...y va a ir a peor.",0,pfbid02rZCoq7Ra1aYr7y3yHQxG6kbBYWdzFyCEbUSjzhXKg2HmWZnXJDM5cni9LYNEtvMYl,Alfonso Delmundo Mundial,2026-05-15,facebook,politica,neutra
1334865802075242,comentario,867799818905785,,"No voto al PP, pero votaré a el para Alcalde, votaré a la persona no al Partido.",4,pfbid02hTwMedZfqvbEMm3tUixKwek8QzQ3c1x282QZ3HtC74K3xrHv55GSEFQ9jhjgZsFCl,Fermina Izquierdo,2026-05-14,facebook,politica,neutra
1334865802075242,comentario,867799818905785,,En Can Alzamora ultimamente nos invaden los cacos,1,100002179631851,Loli Perez Aranega,2026-05-14,facebook,otros,neutra
1419366756889583,comentario,983269900871396,,L’heu apuntat a l’app??? 🫣🤣,2,pfbid03FX76i7n1ojDcULceseowEV38hFAdPGAz66ip84XMAxsqngPzcvkStWgeXR5Jmybl,Avis Districte Dos Urbanitzacions Rubi,2026-05-04,facebook,politica,neutra
1419366756889583,comentario,983269900871396,,Mare meva!🔥,0,pfbid02n1nj53N4whmx59cAm27QDervZCQ87UFNKQTi85cCVPB1BTBUPeGqYfWhyFRRUXQbl,Sonia Rodríguez Tejada,2026-05-04,facebook,otros,negativa
1419366756889583,comentario,983269900871396,,,0,1278670592,Nathalie Capó,2026-05-10,facebook,sin_texto,neutra
1419366756889583,comentario,983269900871396,,Totalmente decord,0,pfbid02TXM3N5WLCLwfFPr5YCZs3Aei62uHEK1yN3G1GKhEy29dhM55y5goBRD3uVQVz4JJl,Yolanda Perdiguer,2026-05-04,facebook,otros,neutra
1419366756889583,comentario,983269900871396,,Totalment!!!,0,pfbid02EG51TFWkvEwKCRfdPDBvjA17nuKpnAy54qqMSWNHNTbAQDAvCkUALjit12amvZPXl,Montse Gutiérrez Lemus,2026-05-05,facebook,otros,neutra
1419366756889583,comentario,983269900871396,,Parada 128 Bages...una vegada més vandalitzada....,0,1278670592,Nathalie Capó,2026-05-10,facebook,transport_public,neutra
1419366756889583,comentario,983269900871396,,Manolo y Benito  los trabajos los realiza más varados y más limpios. Las empresas contratas del excelentísimo ayuntamiento don verdaderas chapuzas,0,1616631757,Antonio Estepa,2026-05-04,facebook,economia_empresa,neutra
1419366756889583,comentario,983269900871396,,"Así está todo Rubí, solo saben poner parches y ala…
Pena, asco y vergüenza",0,pfbid0xxQmTCfgyL7Gv1AKamYUthTFP4Sd28wm12yDugzXa7V2xPnhg6pB37g3BxE2yaEil,Salva Lopez,2026-05-04,facebook,urbanismo_limpieza,negativa
1419366756889583,comentario,983269900871396,,La verdad lo que están haciendo por las urbanizaciones son chapuzas,0,pfbid0XuG5rWAW64GW8RX1jbAU8GC4AGW5z917zENTKpvwAYTwsKLTP7y4PYPGccSHvib4l,Ana Zahiño Espejo,2026-05-05,facebook,servicios_publicos,neutra
1419366756889583,comentario,983269900871396,,"Que tenéis razón, están abandonadas...pero también sois culpables de tener una ZBE en Rubi, ya que ha sido impuesta y no consultada con los habitantes de Rubí. Sois cómplices de una dictadura.",0,pfbid0EJakj8mjhtTvu7u9qXQ2AKTz6tGmGDM6Hvroa6ZiqFtqAVpL5jqTS9XTk54xriZSl,Ismael Lopez Rico,2026-05-10,facebook,urbanismo_limpieza,negativa
1603992321735856,comentario,2193041414866525,,En mi casa comprábamos los frutos secos tostados.,2,pfbid02uq7w6KGYc84vRbTwAtNtuiPTGLjynQ9UK9wCo8rsQeWotmepGaQR5drHx9NryUSsl,Angeles Sanchez Martin,2026-05-26,facebook,otros,neutra
1603992321735856,comentario,2193041414866525,,Per molts anys Núria,1,pfbid02t5fVuGm1zM3q4y9h9yjxvuYhhXnCxJefAtMP4hhiNS9KqhzcZonbH3rDqHPZ8nidl,Ana Casanova Torres,2026-05-26,facebook,tecnologia_innovacio,neutra
1603992321735856,comentario,2193041414866525,,La gent del poble,1,pfbid0unifaKCmTHW6CYchU6TmF83fuf3AAPtpnUNKpcv9aWtsxgB7t7BgVn99wAjgu5Snl,Loli Ñerez,2026-05-26,facebook,otros,neutra
1603992321735856,comentario,2193041414866525,,Feliz cumpleaños Nuria,0,pfbid0LZhwzEuUNV7NAUiqbLqrVR3jVDGFti7oh1ZDJi1ojhZ2ZJ4QZy9VA3oYUsKza7t2l,Rosario Triviyo,2026-05-28,facebook,tecnologia_innovacio,neutra
1603992321735856,comentario,2193041414866525,,Felicidades Nuria. Qué productos de calidad había en tu tienda.,0,pfbid0yp6oCBS3YNorrqixbMgSSePWTSRGGjDJBxqHsuhhjZqYYgKkzDNBGYhysJg6emtal,Encarnación Olmos Torres,2026-05-29,facebook,tecnologia_innovacio,positiva
1603992321735856,comentario,2193041414866525,,"Qui no recorda el Colmado Nuria. Recordo el seu pare amb la bata de botiguer darrera el taulell, una dona molt maca i estimada pels rubinencs.😍😍😍",0,pfbid03juyCAi5YzYj5BT843DhdgWEziAfYuygMASBotL9sHeF4iQef7e93V7BTAJmr5Bdl,Lluïsa Pernas Muray,2026-05-31,facebook,tecnologia_innovacio,positiva
1603992321735856,comentario,2193041414866525,,,1,pfbid02t5fVuGm1zM3q4y9h9yjxvuYhhXnCxJefAtMP4hhiNS9KqhzcZonbH3rDqHPZ8nidl,Ana Casanova Torres,2026-05-26,facebook,sin_texto,neutra
1603992321735856,comentario,2193041414866525,,,0,pfbid02onEDaNwmbYNbQaeYU5SptqepcY3qPReHBVcuX99ef5BGagrNmiXkDq1265bVTyscl,Rosa Maria CG,2026-05-31,facebook,sin_texto,neutra
1441114941392648,comentario,1355323739872347,,Rubí es el gran polígon industrial..els veïns no contem per res..,0,pfbid0rqofV93UZEoLyWaijpAY55cbcrUa8YQ4xQ8SeS1KJQMhphJEfijbRYWseVm1XyATl,Elena Garcia,2026-05-22,facebook,tecnologia_innovacio,neutra
1441114941392648,comentario,1355323739872347,,"Perfecta per la senyora alcaldessa, molt bé, això és el que prima en Rubí, l'empresa sobre la ciutadania un exemple del que preocupa a l'alcaldessa. No has convidat a Rensika la teva protegida?",0,pfbid02LRqoXC2SG4WU8v74p2YeJXpw68ProPAqY7zQuGWDdb25m8YaZrZaTsGdwKMXzUgml,Jordi Vericat,2026-05-22,facebook,politica,positiva
1599712585489392,comentario,pfbid02r85wnVqQV61zbvGHSxtJkojRZ1ZfN7f7peD3k3iH6v91aepuxagWKmZDdcmsTGsjl,,"Como hicieron con Ipagsa, nada de nada. Perdón lo de siempre, bla.bla.blaaaa",0,pfbid02QpQpGqxC8Jfwzxuc9Js5XJ3ikQjW7f5u9oq2zvq4fkNZaurLWLRauC9owFdKBfh7l,David Iglesias Mañas,2026-06-01,facebook,otros,neutra
1599705842156733,comentario,pfbid026ovf8XffCezCWxmvcDknjkyx5PWwWQbhM68N84R8piUprxgnTAhQ9iyPbuUunhwql,,"Cada cop a pitjor, heu pensat que cada cop paguem més impostos i ara haurem de pagar també per la festa major? Us hauria de donar molts vergonya. Deixeu-vos de tant amfiteatre i altres espais d'aforament limitat (¿o ja teniu les reserves d'entrades per als de sempre, abans de la venda?) manera que no hi hagin aglomeracions i que pugui anar tothom que vulgui i li vingui de gust, espais l'Escardivol, parc de Can Oriol, i d'altres espais oberts que tenim a rubí, penso que al poble no sería un problema anar amunt i avall i no hi hauria tanta saturació al centre, promoció d'altres comerços propers, entre d'altres beneficis....
L'any passat hi van haver persones que els van voler lucrar econòmicament i les entrades eren gratuïtes, ara que passarà? Encara més lucre econòmic?
Heu pensat el número de jovent i jo tant jovent que voldran anar a aquests dos concerts, grups que ara mateix, s'escolten en aquest colectiu de joves? Que pasara amb els que es quedin sense entrada?",15,pfbid0VpUT37nfUERnLb4CB9r4GR3oWaqvdeCFUD92ebg9Q4nCBm3fs2BnNz4Zpna1UVwjl,Zaida Mojal Merino,2026-05-29,facebook,cultura_fiestas,negativa
1599705842156733,comentario,pfbid026ovf8XffCezCWxmvcDknjkyx5PWwWQbhM68N84R8piUprxgnTAhQ9iyPbuUunhwql,,Amb sembla   perfecte  així  la gent egoista que hagafa entrades  per tot el bloc  i després  no van així  compraran las  que els fasin falta !!!,15,pfbid0p7EQDdXcj1nJTLQppDEPJugqt8rRHCgmvbhcbQzy5sT3TUyZEzHRT1e8e924xnRVl,Joana Fernández González,2026-05-29,facebook,habitatge_vivenda,neutra
1599705842156733,comentario,pfbid026ovf8XffCezCWxmvcDknjkyx5PWwWQbhM68N84R8piUprxgnTAhQ9iyPbuUunhwql,,Pero os pensáis que ellos no tendrán su entradita ya😂 😂😂😂,4,pfbid0pTSFUMo2K8RdXupVofQffU7d42pj3FEMHm3ETM6orscQwo1frvZkry9MKs5DFMkXl,Cristina Garcia,2026-05-29,facebook,otros,neutra
1599705842156733,comentario,pfbid026ovf8XffCezCWxmvcDknjkyx5PWwWQbhM68N84R8piUprxgnTAhQ9iyPbuUunhwql,,Home 10e? Cal tant? 5e també estaría bé… Per que no passes el que va passar l any passat.,8,pfbid02ru5dVznYyWuaqDXiuxVCSVHbJnUk1m5JowP9zq4bvmuofdX72hmGKYCFpEKUpRZZl,Ruseta Ruseta,2026-05-28,facebook,otros,neutra
1599705842156733,comentario,pfbid026ovf8XffCezCWxmvcDknjkyx5PWwWQbhM68N84R8piUprxgnTAhQ9iyPbuUunhwql,,"La cuestió es fer caixa disimuladament, el ajuntaments no fan gaire gan cos per el poble ' lo saben molt llarga!!!!",4,pfbid02oUD3yhmraCPifmsuo8HnwUnoJpBQjdC8iHkaaK6diHS1moXyp6KorDWhuYPz5QGfl,Ricardo Checa,2026-05-29,facebook,politica,neutra
1599705842156733,comentario,pfbid026ovf8XffCezCWxmvcDknjkyx5PWwWQbhM68N84R8piUprxgnTAhQ9iyPbuUunhwql,,Hem sembla bé... pero... els polítics i els seus amics també pagaran?,3,pfbid0DqwDKgcjBd7SQAVLwGSnV5c5cWQHHCDzRwgEdCrfgCo1xPjEfJXbhahLZUyBJu4Kl,Aitor Tilla,2026-05-29,facebook,politica,neutra
1599705842156733,comentario,pfbid026ovf8XffCezCWxmvcDknjkyx5PWwWQbhM68N84R8piUprxgnTAhQ9iyPbuUunhwql,,preu simbolic???? per vosaltres que teniu bons sous!!!! sense fer res...,3,pfbid02dwAjTPo9JuMJn61V6iZuA3JdqQDMwdN9nNc5xxAj1fQjjSLYvEMRnBp9jkbhzHsnl,Quim Iniesta,2026-05-29,facebook,otros,neutra
1599705842156733,comentario,pfbid026ovf8XffCezCWxmvcDknjkyx5PWwWQbhM68N84R8piUprxgnTAhQ9iyPbuUunhwql,,Vergonya que per festa major es tingui que pagar entrades per veure grups.,4,pfbid0DKTzxNgi1Rm2zMSgJ8K4QU3TT3uF1TcHx5Vz87EvidaGtPJWRo1cyRdtkXo81u5Al,Leuqar Parapokos,2026-05-30,facebook,cultura_fiestas,negativa
1599705842156733,comentario,pfbid026ovf8XffCezCWxmvcDknjkyx5PWwWQbhM68N84R8piUprxgnTAhQ9iyPbuUunhwql,,"Home, 10€, simbòlic?",7,pfbid0crozn8P6UvCuz3K7aZGJfpttRVbWY63TSN6yyxMm9LncujQgKEKG9wUm2WSAPw4kl,César GL,2026-05-28,facebook,otros,neutra
1599705842156733,comentario,pfbid026ovf8XffCezCWxmvcDknjkyx5PWwWQbhM68N84R8piUprxgnTAhQ9iyPbuUunhwql,,Simbòlic per les seves vacances!!!,4,pfbid02gZxHSAJwwM2kzDfCfAU7RjjbQrDB9Qezgv7dEuoHbYYHeYDZH86ZjiJ4acppyKnnl,Noemi Roman Alcañiz,2026-05-29,facebook,otros,neutra
1599655192161798,comentario,pfbid0VGathB3aE2JWTrsVWQpsyMLYHmhrj43W6GnbqMBrL1tkFXF4HSJUdBVcmshqt7U2l,,"Quina sort vaig tenir¡¡¡ Ànims Carles. Resta un any perquè la gent s'ho repensi.
@rubi neix amb l'esperit de plataforma veïnal per tornar a la ciutat tot el que ha perdut. Una abraçada ¡¡
#dittoxrubí
#recuperemrubí
Jordi Dittox Rubi",0,pfbid0sxgAsXMc1HhZkm1FMFm1kiSRhqSWQAeiMNeXAG9G7QB6UStHvBk8QfpbEHR43Mxkl,Jordi Dittox Rubi,2026-05-29,facebook,politica,neutra
1599655192161798,comentario,pfbid0VGathB3aE2JWTrsVWQpsyMLYHmhrj43W6GnbqMBrL1tkFXF4HSJUdBVcmshqt7U2l,,Para que si da asco rubi todo dejado paques mal cuidados,0,100011213535600,Rafael Ortega Rio,2026-05-28,facebook,urbanismo_limpieza,negativa
1438700651634077,comentario,4284418601776096,,Quienes ganes!!!,0,pfbid06VoF47HEXQyYo7sxyYwEt3DmCspo9gJKMFWx62LAe4RQHterJ9ot8k1kQrJAvdpzl,Adela Gómez Marco,2026-05-20,facebook,otros,neutra
1298868245690100,comentario,1628856231709537,,"Adopta, no compris!! 🐾",0,100067008107763,En Comú Podem Rubí,2026-05-19,facebook,otros,neutra
1298868245690100,comentario,1628856231709537,,"Siempre he adoptado 
Rubí necesita un refugio ,que no sea en otra población y empresas externas",1,pfbid0RCuibpKvoZvzgb7kgWzBNTQM9EZX88syWwo3ZTUAUz4berJrv7dcAXzRU8SZ3p4El,Glòria Muy Indignada,2026-05-20,facebook,economia_empresa,neutra
1298868245690100,comentario,1628856231709537,,Lo que teneis que hacer tb es mantener sus espacios en condiciones que los pipican dan pena y el de Antoni Sedó sobretodo!!!,0,pfbid02gZxHSAJwwM2kzDfCfAU7RjjbQrDB9Qezgv7dEuoHbYYHeYDZH86ZjiJ4acppyKnnl,Noemi Roman Alcañiz,2026-05-19,facebook,otros,neutra
1296547949255463,comentario,1908982356432842,,"Fins demà, #firadelacervesa",0,100067008107763,En Comú Podem Rubí,2026-05-16,facebook,cultura_fiestas,neutra
1295944859315772,comentario,1391249052762720,,Vine a veure les dues exposicions d'homenstge a Toni Grau 🐾🎨,0,100067008107763,En Comú Podem Rubí,2026-05-15,facebook,otros,neutra
1295944859315772,comentario,1391249052762720,,Gràcies per tanta generositat a les persones que han cedit les seves obres ❤🙏,1,1152502331,Jordi Arnaiz,2026-05-16,facebook,obras_infraestructuras,positiva
10235454027863710,comentario,2087355948794146,,"hola, cómo estás",0,61585963075142,Jessica Perrin ,2026-05-25,facebook,otros,neutra
10235447982352576,comentario,1613720274091240,,"hola, cómo estás",0,61585963075142,Jessica Perrin ,2026-05-25,facebook,otros,neutra
10235429109560768,comentario,911883845204346,,"Daros una vuelta por can serrafossa.. ximelis… can mir.. castellnou…. 

Eso siiii llevar repelente.. y los calcetines hasta las rodillas porque las hiervas están bien altitas… 
Menuda vergüenza de alcaldesa y de Rubí,…",2,pfbid0Zyq2UFPh1PHuYubcYZKDfp3hiK2iei8v1jZRWzt7hLQbpzmt3DtWP5zCgVcJiaVpl,Ana Jane,2026-05-21,facebook,politica,negativa
10235429109560768,comentario,911883845204346,,"Doncs si el 25 de setembre està abandonat, imagineu urbanitzacions",1,pfbid03FX76i7n1ojDcULceseowEV38hFAdPGAz66ip84XMAxsqngPzcvkStWgeXR5Jmybl,Avis Districte Dos Urbanitzacions Rubi,2026-05-23,facebook,servicios_publicos,negativa
10235429109560768,comentario,911883845204346,,Donde esta M. RAJOY?,1,pfbid02gn5Nvf5vzNra1GcKjqPKuUNnBna9QXmiZ5gYUq5Mki2ybC2X4euSmgSanmSQQQool,Toni Keyboard Robi,2026-05-21,facebook,otros,neutra
10235429109560768,comentario,911883845204346,,Esoetaetodos lovario loarvolequevaalkegaalacaretera nilopda nipasaniupolisia esoase laseñoraecardesa solotienelinpo elsentros,0,pfbid0icLbs5LoitTmctUtocbtAy7J1QGY4x6dLFBjHzNW5Pw4NqAjfjc72Eq9QTtjZKmyl,Adela Sosa,2026-05-21,facebook,tecnologia_innovacio,neutra
10235429109560768,comentario,911883845204346,,👏👏♥️♥️😘,0,pfbid02bu19G7AzpJFXD1msK39PqV12spc3fVWhSWqqef44v3kGAYrWFytLPpDj1UxbE4cEl,Maria Josep Montobbio Carbonell,2026-05-21,facebook,otros,positiva
10235429109560768,comentario,911883845204346,,Bueno.... Pero para la fiesta del Barrio todos corren hacerse fotos con Anita y cía. Eso sí el campo de fútbol cuanto costó al final. .....,2,pfbid02QpQpGqxC8Jfwzxuc9Js5XJ3ikQjW7f5u9oq2zvq4fkNZaurLWLRauC9owFdKBfh7l,David Iglesias Mañas,2026-05-20,facebook,deporte,neutra
10235429109560768,comentario,911883845204346,,"Porque no vieron las aceras de la calle chile 
No puede pasar una solo silla de ruedas tienes que ir por la calle
Quien los asesoran ? El tonto lava a estos del pesoe",0,pfbid0nSULVJUQ2fXbam1G6aqhaKht9otUwnfrLMjU6a7KNXg9Ap9w17ywa6CocCgrVbvkl,Jordi Albert,2026-05-20,facebook,politica,neutra
10235429109560768,comentario,911883845204346,,"Ufff ellos aceptaron vuestra visita ,pero es un gran barrio que sabemos NO PP!!",0,pfbid0RCuibpKvoZvzgb7kgWzBNTQM9EZX88syWwo3ZTUAUz4berJrv7dcAXzRU8SZ3p4El,Glòria Muy Indignada,2026-05-22,facebook,politica,neutra
10235429109560768,comentario,911883845204346,,Juanjo Giner!!! A la calle que no tengáis ni representación por favor!!!,0,pfbid0RCuibpKvoZvzgb7kgWzBNTQM9EZX88syWwo3ZTUAUz4berJrv7dcAXzRU8SZ3p4El,Glòria Muy Indignada,2026-05-22,facebook,otros,neutra
1599351675525483,comentario,pfbid02dzt7uX6aiPQwGc3nz7dxZeishJHFiSH7giZo2U6ALvGHbznT1bNEzYYPMiQXVL7gl,,Al costat del Racó del Llibre han edificat una casa nova. Caldria comprovar si no hi ha hagut cap efecte en la teulada...,2,1630755757,Sergi Turiella,2026-05-30,facebook,salut_sanitat,neutra
1599351675525483,comentario,pfbid02dzt7uX6aiPQwGc3nz7dxZeishJHFiSH7giZo2U6ALvGHbznT1bNEzYYPMiQXVL7gl,,Si no  après mal ningú  !!!!,1,pfbid0p7EQDdXcj1nJTLQppDEPJugqt8rRHCgmvbhcbQzy5sT3TUyZEzHRT1e8e924xnRVl,Joana Fernández González,2026-05-28,facebook,otros,neutra
1599351675525483,comentario,pfbid02dzt7uX6aiPQwGc3nz7dxZeishJHFiSH7giZo2U6ALvGHbznT1bNEzYYPMiQXVL7gl,,Lo único romano es el reloj del ayuntamiento,1,1633337285,Nito Rodríguez,2026-05-29,facebook,politica,neutra
1599351675525483,comentario,pfbid02dzt7uX6aiPQwGc3nz7dxZeishJHFiSH7giZo2U6ALvGHbznT1bNEzYYPMiQXVL7gl,,"Hay dios 🤷no sabía lo del Rincón del Libro.
Si Reco del llibre",6,1511478535,Paqui Muelas,2026-05-28,facebook,otros,neutra
1599351675525483,comentario,pfbid02dzt7uX6aiPQwGc3nz7dxZeishJHFiSH7giZo2U6ALvGHbznT1bNEzYYPMiQXVL7gl,,"Cual quier día la q caerá será la q hay justo al lado de la rectoría de la plaza de la Iglesia,está el bar al lado el parque de los niños ,muy mal",2,pfbid02EQomWhXq2mn3hzRhr2GNLxGnYxTExYszNFkwd1tbKu7LkHQ7VnR6nBevyvc3Qwhrl,Francisca Moreso,2026-05-30,facebook,medio_ambiente,neutra
1599351675525483,comentario,pfbid02dzt7uX6aiPQwGc3nz7dxZeishJHFiSH7giZo2U6ALvGHbznT1bNEzYYPMiQXVL7gl,,"Claro si el edificio tiene más años que el sol y no se arregla nunca.....en fin, menos mal que no ha hecho daño a nadie",2,pfbid0beG63yBavAsfSFob3C1dV29p1WKZNsj5w79swqY24vmwMXuWiyPQ9NntHuWNvJ6wl,Miriam Muñoz Martin,2026-05-29,facebook,habitatge_vivenda,neutra
1599351675525483,comentario,pfbid02dzt7uX6aiPQwGc3nz7dxZeishJHFiSH7giZo2U6ALvGHbznT1bNEzYYPMiQXVL7gl,,Nooooooooooooooo,1,pfbid0TrZvCyEq2BmisNZ96CW7MpDAVP17PpvNqmpPoNwG6t6bgVghGcdmWruEDqJRBELdl,Albert Roma,2026-05-28,facebook,otros,neutra
1599351675525483,comentario,pfbid02dzt7uX6aiPQwGc3nz7dxZeishJHFiSH7giZo2U6ALvGHbznT1bNEzYYPMiQXVL7gl,,Esoque quieredesi,1,pfbid0icLbs5LoitTmctUtocbtAy7J1QGY4x6dLFBjHzNW5Pw4NqAjfjc72Eq9QTtjZKmyl,Adela Sosa,2026-05-28,facebook,joventut_educacio,neutra
1599351675525483,comentario,pfbid02dzt7uX6aiPQwGc3nz7dxZeishJHFiSH7giZo2U6ALvGHbznT1bNEzYYPMiQXVL7gl,,,2,1278670592,Nathalie Capó,2026-05-28,facebook,sin_texto,neutra
1518779163622003,comentario,pfbid0fKskpPSkoiPNcEABYMpG8hUQbAcjJv8yUj7GQhfn1fqoXpuPMkZ6jmUsuSZPGoVUl,,Dada finde caña en rubi,1,100011213535600,Rafael Ortega Rio,2026-05-26,facebook,otros,neutra
1518779163622003,comentario,pfbid0fKskpPSkoiPNcEABYMpG8hUQbAcjJv8yUj7GQhfn1fqoXpuPMkZ6jmUsuSZPGoVUl,,"Un solo día no, esto debería ser todos los días y cada fin de semana todas las policías autonómicas junto con la guardia civil y policía nacional. Rubi es un polvorín",1,100000948110207,Camp Rouse Mari,2026-05-26,facebook,seguridad,neutra
1518779163622003,comentario,pfbid0fKskpPSkoiPNcEABYMpG8hUQbAcjJv8yUj7GQhfn1fqoXpuPMkZ6jmUsuSZPGoVUl,,"Que tal un guantanamo aprop de aqui  i anexo a el una fábrica de manufacturacion de productos del cerdo para que trabajen alli y se pagen el pasaje de vuelta a su puto país y problema solucionado..
  Perfecto",0,pfbid0rhcbmwSNvmp5k1Usdsr2mnoAWtewGWx4NiSLhLaNeh52j59tsSuxprdQsGzHaV5kl,Miguel Albaladejo,2026-05-27,facebook,otros,neutra
1518779163622003,comentario,pfbid0fKskpPSkoiPNcEABYMpG8hUQbAcjJv8yUj7GQhfn1fqoXpuPMkZ6jmUsuSZPGoVUl,,Yo hay algo que no me cuadra... Paran a 52 y solo 2 llevan droga? En rubi? No saben buscar o no estaban en el barrio correcto XD,0,100001635644998,Packo Rodriguez Solano,2026-05-27,facebook,servicios_publicos,neutra
1518779163622003,comentario,pfbid0fKskpPSkoiPNcEABYMpG8hUQbAcjJv8yUj7GQhfn1fqoXpuPMkZ6jmUsuSZPGoVUl,,Rubí es el paraiso gracias a los gobiernos progres no,1,pfbid0jVT11vZLCdjdjyr34PPiq4hatzDGER2PfZF2mRHjuc96mJmC8kfUViKSGrPSfttEl,Jonathan Vaz,2026-05-27,facebook,politica,positiva
1518779163622003,comentario,pfbid0fKskpPSkoiPNcEABYMpG8hUQbAcjJv8yUj7GQhfn1fqoXpuPMkZ6jmUsuSZPGoVUl,,Operación berga,0,100068359912317,Miguel Motero,2026-05-27,facebook,otros,neutra
1518779163622003,comentario,pfbid0fKskpPSkoiPNcEABYMpG8hUQbAcjJv8yUj7GQhfn1fqoXpuPMkZ6jmUsuSZPGoVUl,,Cuanto paripé,1,pfbid02HG9j5YCcadXLgqP8MQUK1n8bqgz9vNanT7aoNeQYBVyvAJjQPHbKyWs7gcgqaoHdl,Pedro Sarrion,2026-05-26,facebook,otros,neutra
1518779163622003,comentario,pfbid0fKskpPSkoiPNcEABYMpG8hUQbAcjJv8yUj7GQhfn1fqoXpuPMkZ6jmUsuSZPGoVUl,,,0,pfbid0iooh4Mb9CdmDZ6WXE7KdZhhM49aYqSkef628DpykVen25z7kTyMsFKABgf3u6tXJl,Loli Fernández Ferreiro,2026-05-26,facebook,sin_texto,neutra
1518779163622003,comentario,pfbid0fKskpPSkoiPNcEABYMpG8hUQbAcjJv8yUj7GQhfn1fqoXpuPMkZ6jmUsuSZPGoVUl,,,0,pfbid021jpfoWXVGFhfbxbPVoPF4HJQKJqT9tSYNGPwpsZWcHv3wVwaRB2MyExZsh27ZLkKl,Rosario Lopez,2026-05-26,facebook,sin_texto,neutra
1518779163622003,comentario,pfbid0fKskpPSkoiPNcEABYMpG8hUQbAcjJv8yUj7GQhfn1fqoXpuPMkZ6jmUsuSZPGoVUl,,,0,pfbid0d8kmEUw6BkeTqjDnisXVy4gBfXvNgxDw3TkTHTic8VszUKodUeyqos4C5R4LPzDvl,Pepi Mendez,2026-05-26,facebook,sin_texto,neutra
1518629193637000,comentario,pfbid0WT4RiFGGKBe7mCpeLsS17YGqgESw2bScyYcmQsJsXBZTq5aRHrNhobjsMzk44j7Ql,,Están vigilando el rodaje de gladiador 3 en el golf !,0,pfbid02xPs7uargtGDZtx3XbMTKuwWz9248cp5EMBVDZC4PfN79b1yK4wUMqAwW8ekWsX6Nl,Manuel Ruiz Fernandez,2026-05-26,facebook,tecnologia_innovacio,neutra
1518629193637000,comentario,pfbid0WT4RiFGGKBe7mCpeLsS17YGqgESw2bScyYcmQsJsXBZTq5aRHrNhobjsMzk44j7Ql,,"Si, si los vi. No es la primera vez",1,pfbid02sEw1N9kdNSi2GQHjP3uLarzmGLjxFco3KyfcZZ9fUbFAjh7mT3QAGddjmsF3x3Gl,Conchita Pérez Martinez,2026-05-26,facebook,otros,neutra
1518629193637000,comentario,pfbid0WT4RiFGGKBe7mCpeLsS17YGqgESw2bScyYcmQsJsXBZTq5aRHrNhobjsMzk44j7Ql,,Si los vi eran chinon de transporte de tropas.,1,pfbid02YAL7n1n8vzfciZDFTr5a6dG2DAjxLWZcPTh5UEeXyDp15VcpzXytu18LV3P7Pu3rl,Antonio Albaladejo Santín,2026-05-26,facebook,otros,neutra
1518629193637000,comentario,pfbid0WT4RiFGGKBe7mCpeLsS17YGqgESw2bScyYcmQsJsXBZTq5aRHrNhobjsMzk44j7Ql,,"Si, a l'alçada estació vella.",0,pfbid03juyCAi5YzYj5BT843DhdgWEziAfYuygMASBotL9sHeF4iQef7e93V7BTAJmr5Bdl,Lluïsa Pernas Muray,2026-05-26,facebook,transport_public,neutra
1518629193637000,comentario,pfbid0WT4RiFGGKBe7mCpeLsS17YGqgESw2bScyYcmQsJsXBZTq5aRHrNhobjsMzk44j7Ql,,Si los 4 pasaron por castellnou,0,pfbid02KniCoX4ATB9aBLKizdsiLhE2q7hpqoMKjWFHcsxum7ewQD4bKBomfX9S1o15CH7ul,Juana Belsue,2026-05-26,facebook,otros,neutra
1518629193637000,comentario,pfbid0WT4RiFGGKBe7mCpeLsS17YGqgESw2bScyYcmQsJsXBZTq5aRHrNhobjsMzk44j7Ql,,Van buscando Narcos. Pues .e parece bien que vigilen. Estaremos mas seguros de tanto delincuente suelto.,0,pfbid0svbpbg1tNFEbseD63eik2FmVaqgwwsE356BWPpophXbNEfAgafDvUqFr61X3Scz3l,Miguel López,2026-05-26,facebook,seguridad,negativa
1518629193637000,comentario,pfbid0WT4RiFGGKBe7mCpeLsS17YGqgESw2bScyYcmQsJsXBZTq5aRHrNhobjsMzk44j7Ql,,,0,pfbid0kWRTjN7dXA5C2rxWNDg2dQBxaG5aGpsox98Rp2JptBgdyKNYqhayo1PoPVMbLDjel,Maurizio Esteban Torres,2026-05-26,facebook,sin_texto,neutra
10235394624778670,comentario,1000411565814408,,,1,pfbid02abeaZW3c5dssKPKjWes2TmdLCrmKBWU3TrgqGF7MnJAKUTyJAa9S7KsJAYgvCEtKl,Jorge Antonio Maquilon Gomez,2026-05-18,facebook,sin_texto,neutra
10235394624778670,comentario,1000411565814408,,"✨💙💙💥💙 2026🌟.
Partido Popular de Rubí.
Excelentísimo Concejal del Ayuntamiento de Rubí y don Señor Juan Carlos Boronat Gómez. Aquí está la realidad de un pueblo abandonado por las injusticias del Socialismo que no miran las realidades de injusticia, desorden llenó de malezas nidos de ratones y excrementos , falta de servicios básicos para nuestro pueblo desde el Norte Sur Éste y Oeste y donde van a parar nuestros impuestos para obtener un buen servicio vasta ya de demagogia es el momento de exigir cambios y el portavoz del Partido Popular de Rubí alzamos nuestra voz con el estandarte nuestra Bandera 🇪🇸💙✨💥 adelante con firmeza Honor Lealtad Justicia y Dignidad la unión hace diferencia.
Afiliado del Partido de Rubí 
Señor Exsar George Balseca Castellanos 💪🪖💙💙⚡💫💙",1,61570929412230,Voluntariado ,2026-05-17,facebook,politica,neutra
1335336292028193,comentario,2453604478415375,,Lo que hay que hacer es juntarnos todos los rubinenses y echar a este tipo de gente fuera. Y a la alcaldesa por supuesto,4,pfbid0RiqHVM8BBEk1Bb3dePiHSzunvWvs5yBY5yDJK2PKvURKLwCN6rnXxcrTwZpkL8sBl,Gerard Torres Polo,2026-05-16,facebook,politica,neutra
1335336292028193,comentario,2453604478415375,,"Habría qué hacer cómo el alcalde de Badalona,ese no sé anda con Tonterías 
,a más de un okupa a echado de casas qué pertenecen a otras personas,ese sí qué es un alcalde qué mira por el pueblo y no por el mismo",1,pfbid02Yrr8ESRdCBXH4g5rpomfzWh3gWhaDHa1Stuygc8ZYMMLfxMfhp8JSswtQpyZbWLdl,Re PE,2026-05-19,facebook,politica,negativa
1335336292028193,comentario,2453604478415375,,Cuando ocupen nuestras casas Te llamamos A ver qué puedes hacer? Blabla bla....más de lo mismo! Cuantas casas hay ocupadas....y que haces?,0,pfbid0y8trCf846aqCht73gvp5ViXdoApimNdMURHc8kFApvhmKyn2LZ1o6tbqbCaNY261l,Issy Smith,2026-05-17,facebook,politica,neutra
1335336292028193,comentario,2453604478415375,,Tenéis lo que botais asín esta todo que pena,0,100002901313686,Antonio Requena Florindo,2026-05-19,facebook,otros,neutra
1335336292028193,comentario,2453604478415375,,Estamos de la COLORINES hasta el moño,1,pfbid0EQopyvRzTftVBbMV9K9rhHAUEGGeSoVqvogrhguxZiBFf2ZpreGQySNznNztJDA6l,Ana Maria Rioja,2026-05-15,facebook,otros,neutra
1335336292028193,comentario,2453604478415375,,Alto y claro.,0,pfbid02hTwMedZfqvbEMm3tUixKwek8QzQ3c1x282QZ3HtC74K3xrHv55GSEFQ9jhjgZsFCl,Fermina Izquierdo,2026-05-16,facebook,otros,neutra
